{
  "$schema": "https://json-schema.org/draft/2020-12/schema",
  "$id": "agent_matrix/schema/agent",
  "type": "object",
  "required": [
    "name",
    "links",
    "form_factor",
    "released_in",
    "latest_major_update",
    "rules",
    "skills",
    "hooks",
    "monitor",
    "custom_model_provider"
  ],
  "properties": {
    "name": {"type": "string", "$comment": "About | Name | Product or coding-agent surface."},
    "links": {"allOf": [{"$ref": "#/$defs/links"}], "$comment": "About | Links | Product links and stable slug."},
    "form_factor": {"allOf": [{"$ref": "#/$defs/stringListWithSource"}], "$comment": "About | Form Factor | CLI, IDE, extension, terminal UI, hosted agent, or hybrid."},
    "released_in": {"allOf": [{"$ref": "#/$defs/stringWithSource"}], "$comment": "About | Released | First public release month and year for this surface."},
    "latest_major_update": {"allOf": [{"$ref": "#/$defs/stringWithSource"}], "$comment": "About | Latest Major Update | Most recent major public update captured in this dataset."},
    "pricing": {"allOf": [{"$ref": "#/$defs/stringWithSource"}], "$comment": "About | Pricing | Product, subscription, first-party coding/model plan, BYOK, and usage-billing pricing source."},
    "some_free_usage": {"allOf": [{"$ref": "#/$defs/featureWithSource"}], "$comment": "Access | Some Free Usage | Has a documented free tier, free mode, free included usage, or local/free-model path for agent work."},
    "no_account_required": {"allOf": [{"$ref": "#/$defs/featureWithSource"}], "$comment": "Access | No Account Required | Can be used for agent work without signing into the product/vendor account, typically via local models."},
    "can_use_other_subscriptions": {"allOf": [{"$ref": "#/$defs/featureWithSource"}], "$comment": "Access | Can Use Other Subscriptions | Can route agent usage through another subscription, provider account, API key, or local inference backend."},
    "rules": {"allOf": [{"$ref": "#/$defs/featureWithSource"}], "$comment": "Context | Rules | Persistent project or global instruction files."},
    "skills": {"allOf": [{"$ref": "#/$defs/featureWithSource"}], "$comment": "Context | Skills | Reusable skill folders, commands, playbooks, or agent capabilities."},
    "hooks": {"allOf": [{"$ref": "#/$defs/featureWithSource"}], "$comment": "Automation | Hooks | User-configurable lifecycle hooks or event hooks."},
    "mcp_servers": {"allOf": [{"$ref": "#/$defs/featureWithSource"}], "$comment": "Integration | MCP | Model Context Protocol server support."},
    "custom_commands": {"allOf": [{"$ref": "#/$defs/featureWithSource"}], "$comment": "Automation | Commands | User-defined slash/custom commands."},
    "goal_command": {"allOf": [{"$ref": "#/$defs/featureWithSource"}], "$comment": "Automation | /goal | Built-in `/goal` slash command for a persistent session objective that auto-continues until a completion condition is met (or pause/clear)."},
    "subagents": {"allOf": [{"$ref": "#/$defs/featureWithSource"}], "$comment": "Automation | Subagents | First-class custom or delegated subagent support."},
    "monitor": {"allOf": [{"$ref": "#/$defs/featureWithSource"}], "$comment": "Automation | Monitor | Background monitor/watch capability that lets the agent wait on, observe, or react to long-running commands, subagents, jobs, logs, WebSockets, or task status changes without blocking normal interaction."},
    "transcripts": {"allOf": [{"$ref": "#/$defs/featureWithSource"}], "$comment": "Context | Transcripts | Local or exported conversation/session transcript storage."},
    "model_selection": {"allOf": [{"$ref": "#/$defs/featureWithSource"}], "$comment": "Settings | Model | Explicit model selection in CLI/settings."},
    "approval_mode": {"allOf": [{"$ref": "#/$defs/featureWithSource"}], "$comment": "Settings | Approvals | Approval or permission-mode controls."},
    "sandbox_mode": {"allOf": [{"$ref": "#/$defs/featureWithSource"}], "$comment": "Settings | Sandbox | Filesystem/network/terminal sandbox controls."},
    "resume": {"allOf": [{"$ref": "#/$defs/featureWithSource"}], "$comment": "Settings | Resume | Resume or continue previous sessions."},
    "continue": {"allOf": [{"$ref": "#/$defs/featureWithSource"}], "$comment": "Settings | Continue | Continue the latest/current session without specifying an ID."},
    "non_interactive": {"allOf": [{"$ref": "#/$defs/featureWithSource"}], "$comment": "Settings | Headless | Non-interactive print/run mode."},
    "output_format": {"allOf": [{"$ref": "#/$defs/featureWithSource"}], "$comment": "Settings | Output Format | Machine-readable or alternate output format controls."},
    "statusline": {"allOf": [{"$ref": "#/$defs/featureWithSource"}], "$comment": "Settings | Status Line | User-configurable CLI status line or equivalent."},
    "telemetry": {"allOf": [{"$ref": "#/$defs/featureWithSource"}], "$comment": "Settings | Telemetry | User-visible telemetry/privacy settings."},
    "keyboard_shortcuts": {"allOf": [{"$ref": "#/$defs/featureWithSource"}], "$comment": "Settings | Keybindings | User-customizable keyboard shortcuts or keybindings."},
    "theme_customization": {"allOf": [{"$ref": "#/$defs/featureWithSource"}], "$comment": "Settings | Theme | Dark/light mode, custom themes, or UI color scheme customization."},
    "auto_save": {"allOf": [{"$ref": "#/$defs/featureWithSource"}], "$comment": "Settings | Auto-Save | Automatic file or session save behavior controls."},
    "debugging_output": {"allOf": [{"$ref": "#/$defs/featureWithSource"}], "$comment": "Settings | Debug Output | Verbose logging, debug mode, or diagnostic output controls."},
    "context_window": {"allOf": [{"$ref": "#/$defs/featureWithSource"}], "$comment": "Settings | Context Window | Configurable context length or token limits."},
    "code_formatting": {"allOf": [{"$ref": "#/$defs/featureWithSource"}], "$comment": "Settings | Code Formatting | Built-in formatter/linter integration or customization."},
    "git_integration": {"allOf": [{"$ref": "#/$defs/featureWithSource"}], "$comment": "Settings | Git Integration | Git command support, diff viewing, branch management."},
    "performance_mode": {"allOf": [{"$ref": "#/$defs/featureWithSource"}], "$comment": "Settings | Performance | Caching, optimization, or performance tuning controls."},
    "ui_customization": {"allOf": [{"$ref": "#/$defs/featureWithSource"}], "$comment": "Settings | UI Customization | Sidebar, layout, panel arrangement customization."},
    "hosted_agent": {"allOf": [{"$ref": "#/$defs/featureWithSource"}], "$comment": "Platform | Hosted Agent | Managed cloud/hosted agent platform."},
    "custom_model_provider": {"allOf": [{"$ref": "#/$defs/featureWithSource"}], "$comment": "Models | Arbitrary Models | Ability to plug in arbitrary model providers or OpenAI-compatible endpoints."},
    "notes": {"type": "string", "$comment": "About | Notes | Short caveats for interpretation."}
  },
  "$defs": {
    "links": {
      "type": "object",
      "required": ["docs", "github", "website", "slug"],
      "properties": {
        "docs": {"type": "string"},
        "github": {"type": "string"},
        "website": {"type": "string"},
        "company_website": {"type": "string", "$comment": "Optional company/publisher site used by the separate Company logo row."},
        "slug": {"type": "string"}
      }
    },
    "featureWithSource": {
      "type": "object",
      "required": ["support", "source_url", "comment"],
      "properties": {
        "support": {"enum": ["", "none", "partial", "full", "unknown"]},
        "source_url": {"type": "string"},
        "comment": {"type": "string"}
      }
    },
    "stringWithSource": {
      "type": "object",
      "required": ["value", "source_url", "comment"],
      "properties": {
        "value": {"type": "string"},
        "source_url": {"type": "string"},
        "comment": {"type": "string"},
        "sort_date": {
          "type": "string",
          "pattern": "^\\d{4}-\\d{2}-\\d{2}$",
          "$comment": "ISO date for column sorting (often set at bundle time from GitHub)."
        }
      }
    },
    "stringListWithSource": {
      "type": "object",
      "required": ["values", "source_url", "comment"],
      "properties": {
        "values": {"type": "array", "items": {"type": "string"}},
        "source_url": {"type": "string"},
        "comment": {"type": "string"},
        "links": {
          "type": "object",
          "additionalProperties": {"type": "string"},
          "$comment": "Per-form-factor install/download links keyed by display value, e.g. CLI, IDE, Extension, SDK, Web, Mac App."
        }
      }
    }
  }
}
